{"schema_version":"1.0","result_type":"canonical-engine-result","artifact_id":"85000000-0000-4000-8000-000000000001","analysis_id":"82000000-0000-4000-8000-000000000001","execution_id":"83000000-0000-4000-8000-000000000001","tenant_resource_version":7,"engine":{"engine_id":"smartperfetto","adapter_version":"1.0.0","source_contract":"workspace-agent-v1","source_commit_sha":"1111111111111111111111111111111111111111","image_digest":"sha256:2222222222222222222222222222222222222222222222222222222222222222"},"attempt":{"number":1,"input_manifest_hash":"3333333333333333333333333333333333333333333333333333333333333333","config_hash":"4444444444444444444444444444444444444444444444444444444444444444"},"result":{"state":"completed","payload_sha256":"5555555555555555555555555555555555555555555555555555555555555555","payload":{"reportId":"external-report-id","report":{"resultContract":{"version":"1.0.0"},"dataEnvelopes":[{"type":"data-envelope@1","id":"startup","scenario":"startup","evidence":[{"id":"startup-display","source":"perfetto.startup","queryId":"startup.display","intervalStartNs":10,"intervalEndNs":20,"fields":{"duration_ms":812.4}}],"columns":[{"type":"metric@1","id":"startup.display","name":"startup.time_to_initial_display_ms","value":812.4,"unit":"ms","definition":"Time to initial display.","threshold":{"operator":"lte","value":700,"unit":"ms"},"evidenceId":"startup-display"}],"traceHealth":{"parseStatus":"parsed","traceStartNs":0,"traceEndNs":1000,"targetResolution":{"packageName":"com.example","processName":"com.example","upid":1,"pid":2,"mainThreadId":2},"measurementWindow":{"startNs":0,"endNs":1000,"coverage":"complete"},"dataLoss":{"bufferOverruns":0,"ftraceEventsLost":0,"tracedBufPatchesFailed":0,"incompleteSlices":0,"boundaryTruncations":0},"frameTimelineCoverage":"available","targetDisplayCoverage":"available","refreshModeCoverage":"available"},"capabilities":[{"name":"android_startups","required":true,"status":"available","reason":null}]},{"type":"data-envelope@1","id":"scroll","scenario":"scroll","evidence":[{"id":"scroll-jank","source":"perfetto.scroll","queryId":"scroll.jank","intervalStartNs":30,"intervalEndNs":40,"fields":{"jank_percent":3.1}}],"columns":[{"type":"metric@1","id":"scroll.jank","name":"scroll.jank_percent","value":3.1,"unit":"%","definition":"Janky frame rate.","threshold":null,"evidenceId":"scroll-jank"}],"traceHealth":{"parseStatus":"parsed","traceStartNs":0,"traceEndNs":1000,"targetResolution":{"packageName":"com.example","processName":"com.example","upid":1,"pid":2,"mainThreadId":2},"measurementWindow":{"startNs":0,"endNs":1000,"coverage":"complete"},"dataLoss":{"bufferOverruns":0,"ftraceEventsLost":0,"tracedBufPatchesFailed":0,"incompleteSlices":0,"boundaryTruncations":0},"frameTimelineCoverage":"available","targetDisplayCoverage":"available","refreshModeCoverage":"available"},"capabilities":[]}],"claimVerificationResult":[{"claimId":"startup.delay","verified":true,"confidence":"high","evidenceIds":["startup-display"]},{"claimId":"scroll.partial","verified":false,"partial":true,"confidence":"medium","evidenceIds":["scroll-jank"]}],"diagnostics":[{"id":"startup.delay","scenario":"startup","ruleId":"startup.display_delay","kind":"symptom","status":"confirmed","severity":"high","confidence":"high","title":"Slow startup","summary":"Initial display exceeds the configured target.","claimRef":"startup.delay","recommendation":"Reduce launch work.","retest":"Repeat cold start."},{"id":"scroll.unverified","scenario":"scroll","ruleId":"scroll.unverified","kind":"symptom","status":"suspected","severity":"warning","confidence":"high","title":"Unverified","summary":"Must remain a limitation.","claimRef":"missing"}],"actions":[{"id":"external-action","toolCallId":"tool-secret"}],"identityResolutions":{"contract":"identity_contract@1"},"conversationTimeline":["conversation-secret"],"queryHistory":["query-secret"],"analysisNotes":["notes-secret"],"query":"echoed-query-secret","sessionId":"session-secret","workspaceId":"workspace-secret","runId":"run-secret"}}}}
